{
  "agentfax": "0.1",
  "title": "Office move: what changes on Monday",
  "from": { "name": "Facilities", "origin": "https://fax.example.com" },
  "to": "Everyone",
  "note": "Nothing needed from you. Read when you have a minute.",
  "content": { "text": "From Monday we work from the 4th floor.\nBadges are reissued at the front desk from 8:30.\nDesks are unassigned; lockers are on the east wall.\nParking is unchanged." },
  "questions": [],
  "ack": true,
  "reply": { "link": "https://fax.example.com/f/Rw72pd#", "format": "id=value pairs, URL-encoded, joined with &" },
  "about": "https://github.com/sptr11/agentfax/blob/main/SPEC.md"
}
